platform,consumer_search_coverage,creative_template_orientation,visual_diversity,category_intent_clarity,curify_actionability,overall_positioning,notes
Curify,3,4,3,4,5,Creative-first template search engine with intent clusters; strongest for educational and character templates; weaker on broad consumer visual browse,53/58 ok; 5 ok_empty (recipe queries); cluster chips (8-cluster) provide strong intent navigation; full top-10 rate only 57% for creative queries
Google Images,5,2,5,4,4,Gold standard consumer visual search; best broad recall benchmark across all 58 queries; related-search chips average 17 per query,58/58 complete; avg 17.7 labels (related searches); 100% full top-10; best for query intent taxonomy and category expansion
Bing Images,5,2,4,5,3,High-recall consumer image search with richest related-search taxonomy; top label source for category expansion; less actionable for template routing,58/58 ok; avg 39.9 labels (highest of all platforms); 100% full top-10; strong category signal but no template/printable orientation
Pinterest,4,4,5,2,4,Best visual inspiration and sub-intent discovery; strong for creative and consumer mix; label signals limited by login modal but result diversity is highest,58/58 ok; 40/58 label=0 (login modal); 100% full top-10; board clusters reveal sub-intent even without explicit chips
Canva,2,5,3,4,5,Best-in-class for template and design intent; directly comparable to Curify template routing; 36/58 ok; CJK queries mostly login_required,36/58 ok; 21/58 login_required (mostly CJK); 1 partial; avg 43 labels for ok queries; template categories very clear for English queries
